"Timecode","Content"
"00:16:46,913 --> 00:16:52,506","But it's easy to get distracted by the mechanics of solving puzzles and think that the story is kind of resolving."
"00:16:52,506 --> 00:16:55,417","And the ""A"" plot does resolve in adventure games."
"00:16:55,417 --> 00:17:04,291","Like your action plot resolves because the character achieves their goals, but the ""B"" plot's like the emotional plot often, it's kind of left."
"00:17:04,291 --> 00:17:07,803","Where it's summed up by the two characters kissing at the end or something like that."
"00:17:07,804 --> 00:17:13,810","But to have actually sum up in a meaningful way for the characters is something I have to do."
"00:17:15,880 --> 00:17:16,620","Schafer: The game?"
"00:17:19,382 --> 00:17:21,827","Schafer: May? No."
"00:17:21,827 --> 00:17:26,502","I really am trying everything to make sure the game comes out this year."
"00:17:26,502 --> 00:17:27,850","And then people always go what?"
"00:17:27,851 --> 00:17:31,445","And then I say, the first act took two years."
"00:17:31,445 --> 00:17:37,333","And so if the second act can take less than one year, it's a miracle."
"00:17:37,333 --> 00:17:39,553","And that's what we're doing."
"00:17:39,560 --> 00:17:46,022","Rice: If the directive is we want to ship by the end of the year, I think we've talked a lot about like things that would need to happen"
"00:17:46,407 --> 00:17:52,245","to make that doable, to like where if we timeboxed a scheduled to December,"
"00:17:52,245 --> 00:17:55,183","we'd still have to do some stuff to pull it in a little bit."
"00:17:55,183 --> 00:17:58,420","I think that's the conversation that we need to have, I guess."
"00:17:58,420 --> 00:18:05,570","'Cause if not, like it's going to be very easy to just keep pushing stuff back like we did on Act One."
"00:18:05,570 --> 00:18:11,518","Schafer: Well, the two big reasons, two of the big reasons are, or three, there's like backer expectations because they,"
"00:18:11,518 --> 00:18:14,239","a lot of people thought it was going to come out like two months after Act One."
"00:18:14,239 --> 00:18:17,166","So that message thing that we kind of have to get out to people."
"00:18:17,166 --> 00:18:22,197","Like a couple people I've talked to, it's like I hope it's coming out this year, so there's like that."
"00:18:22,197 --> 00:18:28,809","There is financial, just that Justin has been working with December in all his financial planning, you know."
"00:18:28,809 --> 00:18:31,045","So that's a pretty hard thing."
"00:18:31,045 --> 00:18:34,360","Rice: Yeah, both for getting profit in and for spending on the project."
"00:18:34,360 --> 00:18:36,206","Schafer: Yeah."
"00:18:36,206 --> 00:18:40,586","And for me, just the possibility of actually being up for awards because we shipped the first half this year."
"00:18:40,586 --> 00:18:50,409","So we're either going to be not eligible for 2014 awards or really coming out in January or March of 2015,"
"00:18:50,409 --> 00:18:53,135","when everyone will forget about it by the time the '15 awards come out."
"00:18:53,135 --> 00:18:54,773","So there's that."
"00:18:54,773 --> 00:19:00,659","Rice: I think those are all the right reasons and all the reasons that I feel like everyone I've talked to about this wants to really make December happen,"
"00:19:00,659 --> 00:19:08,731","but I think that it's, it's just going in knowing that that would mean like, doing whatever it takes to make that happen."
"00:19:08,731 --> 00:19:10,834","And sacrificing in some ways."
"00:19:10,834 --> 00:19:13,935","Petty: It's possible. It's possible."
"00:19:13,935 --> 00:19:18,095","You know, most video game productions are a series of bottlenecks."
"00:19:18,095 --> 00:19:24,056","And trying to get everything unblocked with minimal bottlenecks is what's going to make or break December."
"00:19:24,056 --> 00:19:28,646","Although the other problem with December is there's a lot of unknowns as it comes to puzzle playability and testing."
"00:19:28,646 --> 00:19:33,439","So we can take certain steps, like we can try and work through earlier versions or script early versions and test them,"
"00:19:33,439 --> 00:19:38,919","but you know, ultimately that's the fun factor and that's a little hard to know how that's going to hit."
"00:19:38,919 --> 00:19:45,329","And when you don't leave yourself a lot of iteration time, it may not be enough and you don't really know."
"00:19:45,329 --> 00:19:47,017","Schafer: I think we can do December."
"00:19:47,017 --> 00:19:49,524","To me it's like an infinity far away."
"00:19:49,524 --> 00:19:53,379","I always think we can do anything."
"00:19:53,379 --> 00:19:56,411","That's why my games are sometimes late."
"00:19:56,411 --> 00:20:01,862","Schafer: It's really just the best game that we can make and we feel like we can actually make without crashing the company into the ground."
"00:20:01,862 --> 00:20:06,203","And they also just want to finish it because it's, while it's fresh in people's minds."
"00:20:06,203 --> 00:20:11,010","And I do want to get the team back and there's a pressure to keep them on other projects because they have these publisher milestones."
"00:20:11,010 --> 00:20:16,645","And publisher milestones are always scarier than internal milestones, because there's no outside force threatening to"
"00:20:16,645 --> 00:20:19,749","not pay you if you don't meet the milestones."
"00:20:19,749 --> 00:20:22,584","So we have to be that threatening outside force."
"00:20:22,584 --> 00:20:25,582","Can you make some phone calls from outside the building with a funny voice?"
"00:20:25,582 --> 00:20:26,641","Hansen: I can."
"00:20:26,641 --> 00:20:31,183","Schafer: And be like, we won't pay you guys if you don't meet your milestones on this project."
"00:20:31,183 --> 00:20:33,123","Hansen: I'm pretty sure they're going to figure out that it's me."
"00:20:35,128 --> 00:20:36,393","Schafer: Well, that's the other big factor, right."
"00:20:36,393 --> 00:20:41,327","Is we went to this smaller team, which I think from a budget standpoint was a good idea, 'cause you were writing."
"00:20:41,327 --> 00:20:44,239","Bagel and I could do some early concept work and stuff."
"00:20:44,239 --> 00:20:48,549","If we were working from a no, this is the target deadline, that is not a good way to work."
"00:20:48,549 --> 00:20:53,552","If it's a, this is our target budget and so we're lowering the berm while we figure stuff out."
"00:20:53,552 --> 00:20:59,801","But if we were like, no, this is an unmovable time here in December, then we should have, I mean this is in hindsight,"
"00:20:59,801 --> 00:21:06,352","but we probably should have tried to get more of the team and start full production like right after AF or something."
"00:21:06,352 --> 00:21:07,986","Hansen: Yeah, but we couldn't have."
"00:21:07,986 --> 00:21:11,861","There wasn't enough design to execute on at that point."
"00:21:11,861 --> 00:21:15,703","Petty: Perhaps. But I mean, I'm just, you know, that's, I think it's just one of the other factors,"
"00:21:15,703 --> 00:21:20,502","I think, is that it felt good to have a small team for a while, while we sort of like could digest some of these things"
"00:21:20,502 --> 00:21:21,958","and Oliver was working on a platform."
"00:21:21,958 --> 00:21:24,775","But it did sort of put this maybe end date a little bit in jeopardy."
"00:21:24,775 --> 00:21:26,326","Team Member: That's very true."
"00:21:26,326 --> 00:21:31,089","Schafer: So maybe Oliver's stuff will make so much money we can have more time to make Act Two."
"00:21:31,089 --> 00:21:33,125","Rice: It sounds like we're not going to have more time, though, right?"
"00:21:33,125 --> 00:21:36,261","It sounds like we could have more money to throw at the problem and put..."
"00:21:36,261 --> 00:21:40,181","Schafer: Oh yeah. Maybe that will make more, we'll buy some more people."
"00:21:44,226 --> 00:21:46,976","Franzke: Yeah. It works pretty well."
"00:21:46,976 --> 00:21:51,336","I'm overall, like pretty happy with how it turned out."
"00:21:51,336 --> 00:21:53,376","The load times aren't terrible."
"00:21:53,376 --> 00:21:57,576","You know, we were able to get a lot of visual fidelity out of the game."
"00:21:57,576 --> 00:22:04,989","You know, essentially making it look as good as on PC, which I'm pretty happy about."
"00:22:04,989 --> 00:22:06,809","So if I go on the app store."
"00:22:06,809 --> 00:22:10,828","What is cool, is like obviously if you go to games, it's right there, Broken Age."
"00:22:10,828 --> 00:22:13,296","It's also in Best New Games, which is nice."
"00:22:13,296 --> 00:22:16,441","And that seems to be trending pretty well also in the charts."
"00:22:16,441 --> 00:22:19,968","So I would say overall, so far it's been a really successful launch."
"00:22:19,968 --> 00:22:26,109","Schafer: Last night I spent unknown hours playing through Broken Age and I'm so glad I did but I didn't know I was going to end unfinished."
"00:22:26,109 --> 00:22:28,109","Uh oh."
"00:22:29,334 --> 00:22:32,445","We don't really call it Part One on the app store."
"00:22:32,445 --> 00:22:36,672","I should say Part, should I say, does this guy say Part Two coming soon."
"00:22:36,672 --> 00:22:38,066","Should I say ""soon""?"
"00:22:38,066 --> 00:22:43,121","If children love this as much as Day of the Tentacle or Psychonauts, then please mark me as fuddy-duddy and ignore me."
"00:22:43,121 --> 00:22:44,588","OK, where do I do that?"
"00:22:44,588 --> 00:22:45,958","It was like no game I've ever played."
"00:22:45,958 --> 00:22:47,538","It doesn't glitch or crash."
"00:22:49,095 --> 00:22:51,596","The story is great and I can't wait for Act Two."
"00:22:51,596 --> 00:22:52,394","Two stars."
"00:22:52,394 --> 00:22:53,577","Not as advertised."
"00:22:53,577 --> 00:22:58,172","This game says ages 9 through 11 and that's about all I think would be fun for."
"00:22:58,172 --> 00:22:59,539","Oh, and the fake train wreck?"
"00:22:59,539 --> 00:23:00,969","Why are we doing this over and over again?"
"00:23:00,969 --> 00:23:04,573","The kid actually says he'd rather jump off a cliff than do it again or something like that."
"00:23:04,573 --> 00:23:05,778","That's how I feel as well."
"00:23:05,778 --> 00:23:07,092","Please refund."
"00:23:07,092 --> 00:23:09,112","There's no way this game is worth the price."
"00:23:13,005 --> 00:23:15,825","I think he' stuck on the train."
"00:23:15,825 --> 00:23:18,325","So maybe that wasn't too easy after all."
"00:23:20,421 --> 00:23:22,991","Anyway. Overall it's really good."
"00:23:23,000 --> 00:23:23,700","On the iPad."
"00:23:23,700 --> 00:23:25,221","Schafer: Very happy with the iPad launch."
"00:23:25,460 --> 00:23:26,300","I'm good."
"00:23:27,611 --> 00:23:35,169","Franzke: I think we will know in a few days, kind of from some of our third-party tools that send us information about app sales."
"00:23:35,169 --> 00:23:38,489","But yeah, fingers crossed."
"00:23:39,095 --> 00:23:43,415","Bailey: So moving on, Broken Age did decent sales on iPhone."
"00:23:43,780 --> 00:23:44,400","Stamos: iPad."
"00:23:44,600 --> 00:23:45,727","Bailey: iPad, sorry."
"00:23:46,340 --> 00:23:51,100","Decent enough that we're looking into doing iPhone and potentially android tablets with it."
"00:23:51,561 --> 00:23:53,591","So that was good."
"00:23:53,591 --> 00:23:54,875","It's meeting forecasts."
"00:23:54,875 --> 00:23:58,355","It's not like a runaway hit, but it's, you know, it's good."
"00:23:58,355 --> 00:23:59,735","It's decent cash flow."
"00:23:59,740 --> 00:24:03,500","So the numbers right now are about 100,000 for, you know, four days."
"00:24:03,818 --> 00:24:09,450","So expect for the actual feature week, while I'd say editor's choice, it'll probably be around 150,000"
"00:24:09,870 --> 00:24:15,387","and then it'll probably go down about one-fourth of that for the next week, while it's as a previous editor's choice."
"00:24:15,387 --> 00:24:17,707","So yeah, decent, decent numbers."
"00:24:17,707 --> 00:24:19,623","Bailey: So it was received well."
"00:24:19,623 --> 00:24:25,391","It looks like it's, it's, it's doing what our expectations were sales-wise."
"00:24:25,772 --> 00:24:28,548","Offscreen Voice: Expectations?"
"00:24:28,548 --> 00:24:34,382","Bailey: Yeah, I mean you can expect, you know, about 100 to $150,000 is what I expect out of a week"
"00:24:34,382 --> 00:24:38,941","for an iOS game that's a content-based game. Yeah."
"00:24:38,941 --> 00:24:41,677","Schafer: I think he was telling me they performed to his expectations."
"00:24:41,677 --> 00:24:48,163","They met his sales forecast, but of course forecasts are always pretty conservative."
"00:24:48,163 --> 00:24:51,339","So he's always secretly hoping that his sales forecasts are wrong."
"00:24:51,339 --> 00:24:57,304","Bailey: My expectation, just to be clear, though, they're more about, my expectations are more reflective of the current market"
"00:24:57,304 --> 00:25:01,010","on like iTunes for premium based games."
"00:25:01,010 --> 00:25:03,291","And like paid content based games."
"00:25:03,291 --> 00:25:09,391","So it's less of a reflection about the game and more a reflection about the market."
"00:25:11,339 --> 00:25:13,566","Schafer: We were at number four, now we're at number ten."
"00:25:13,566 --> 00:25:19,319","We might not be number ten anymore, but it was fun to be number four for a long time."
"00:25:19,319 --> 00:25:22,804","Well, we finally got pushed off ten."
"00:25:22,804 --> 00:25:28,123","Let's see how far down we are. Twenty-two."
"00:25:28,123 --> 00:25:30,969","This looks dirty."
"00:25:30,969 --> 00:25:33,965","Beaten by ""Frozen Karaoke""."
"00:25:33,965 --> 00:25:39,776","Schafer: Yeah, I mean, I'm happy with the performance on iPad, but I don't think it made a lot of extra money that's going to allow us"
"00:25:39,776 --> 00:25:42,655","to like hire another programmer and throw him at the team."
"00:25:42,655 --> 00:25:46,333","So I don't think it's going to change the schedule, unfortunately."
"00:25:46,333 --> 00:25:48,272","We can always hope."
"00:25:48,272 --> 00:25:56,481","I keep promising that I will stop hoping for those kind of things, but it's hard not to think about like, what if it was a big hit,"
"00:25:56,481 --> 00:25:58,641","then we could totally hire a programmer to help finish it."
"00:26:01,329 --> 00:26:04,691","But I don't know."
"00:26:04,691 --> 00:26:07,371","But I'm just happy it made enough that we can stay in business."
"00:26:08,818 --> 00:26:10,840","Bailey: It's just there's no magic bullet, basically."
"00:26:10,840 --> 00:26:15,133","So you know, it's, everything's a grind, especially in the game industry."
"00:26:15,133 --> 00:26:25,246","Like, you know, you have to have an amazing press and get the feature spots and get huge VO and have amazing polish and then do OK."
"00:26:25,246 --> 00:26:28,414","But if you didn't have any of that stuff, you'd do horrible."
"00:26:28,414 --> 00:26:33,300","So the, yeah. The hit."
"00:26:33,300 --> 00:26:37,600","The hit has been, has been elusive, for sure."
"00:26:39,980 --> 00:27:21,498","[Music] Schafer: What did you guys think of it?"
"00:27:21,498 --> 00:27:24,305","Offscreen Voice: What's that notepad that says, ""the end"" on it, right there."
"00:27:24,305 --> 00:27:26,722","Schafer: Oh. This is how things are going to end."
"00:27:26,722 --> 00:27:33,374","This is the guy who guessed that Shay's ship was Mog Chothra."
"00:27:33,374 --> 00:27:37,675","I'm super happy that no one seemed to have guessed the big spoiler at the end of it."
"00:27:37,675 --> 00:27:39,283","I really thought that was going to get out."
"00:27:39,283 --> 00:27:43,774","And actually long ago on the forum one guy guessed it."
"00:27:43,774 --> 00:27:45,606","And no one followed up on it."
"00:27:45,606 --> 00:27:49,188","Like no one, he just said his little thing, hey, what if this is the case?"
"00:27:49,188 --> 00:27:50,876","No one answered him."
"00:27:50,876 --> 00:27:52,682","I was like, oh man."
"00:27:52,682 --> 00:28:01,748","Schafer: By the way, since I was the guy who guessed that, by the way, here's how I figured out how it, how this, why I'm so smart."
"00:28:01,748 --> 00:28:04,993","And then here's how what I think is going to happen in Act Two."
"00:28:04,993 --> 00:28:06,455","Offscreen Voice: He's done it for you."
"00:28:06,455 --> 00:28:08,183","Schafer: Yeah. What if I get a bunch of ideas from him."
"00:28:08,183 --> 00:28:11,412","Might be bad."
"00:28:11,412 --> 00:28:14,859","People send me stuff as if I have time to read anything."
